{
  "ID": "lat-pelles",
  "listID": "auth0|999999999999999999999999-lat",
  "userID": "auth0|999999999999999999999999",
  "languageCode": "lat",
  "targetWord": "pelles",
  "important": false,
  "createdDT": "2019\/10\/03 @ 15:46:35",
  "homonym": {
    "targetWord": "pelles",
    "lemmasList": "pello, pellis"
  },
  "context": [
    {
      "target": {
        "source": "",
        "selector": {
          "type": "TextQuoteSelector",
          "exact": "pelles",
          "prefix": "Atque in eam se consuetudinem adduxerunt ut locis frigidissimis neque vestitus praeter",
          "suffix": "habeant quicquam, quarum propter exiguitatem magna est corporis pars aperta, et laventur in fluminibus.",
          "languageCode": "lat"
        }
      },
      "languageCode": "lat",
      "targetWord": "pelles",
      "createdDT": "2019\/10\/03 @ 15:46:35"
    }
  ]
}